{
  "schema_version": "1",
  "kind": "npc_ranged_simulation_result",
  "request": {
    "schema_version": "1",
    "kind": "npc_ranged_simulation",
    "request_id": "example:brigands:1x1",
    "ruleset": "towr-pg1.4-gmg1.1",
    "simulation": {
      "master_seed": "20260928",
      "trials": 3,
      "round_budget": 5
    },
    "execution": {
      "mode": "sequential"
    },
    "scenario": {
      "definitions": [
        {
          "id": "brigand:ranged",
          "source_rule_id": "RULE-PROFILE-TALABEC-004",
          "resilience": {
            "toughness": 3,
            "bonus": 1
          },
          "attack": {
            "id": "warbow",
            "source_rule_id": "RULE-PROFILE-TALABEC-004:warbow",
            "dice": 3,
            "threshold": 3,
            "damage": 3
          },
          "protection": {
            "source_rule_id": "RULE-PROFILE-TALABEC-004:protection",
            "dice": 3,
            "threshold": 2
          }
        }
      ],
      "actors": [
        {
          "id": "archer:a",
          "definition_id": "brigand:ranged",
          "side": "players_and_allies",
          "zone_id": "left"
        },
        {
          "id": "archer:b",
          "definition_id": "brigand:ranged",
          "side": "opposition",
          "zone_id": "right"
        }
      ],
      "battlefield": {
        "zone_ids": [
          "left",
          "right"
        ],
        "connections": [
          {
            "first_zone_id": "left",
            "second_zone_id": "right"
          }
        ]
      },
      "side_order": [
        "players_and_allies",
        "opposition"
      ],
      "actor_order": [
        "archer:a",
        "archer:b"
      ],
      "perspective_side": "players_and_allies",
      "objective_target_ids": [
        "archer:b"
      ],
      "facts": {
        "target_range": "medium",
        "has_enemy_in_close_range": false,
        "targets_aware": true,
        "clear_line_of_sight": true,
        "stationary": true,
        "unmodified_tests": true,
        "no_additional_rules": true,
        "ammunition_sufficient": true,
        "requires_reload_action": false
      },
      "repeated_stagger_choice": "suffer_wound",
      "actor_policies": [
        {
          "actor_id": "archer:a",
          "targets": [
            {
              "target_id": "archer:b",
              "disposition": "knocked_out",
              "gm_approved": true
            }
          ]
        },
        {
          "actor_id": "archer:b",
          "targets": [
            {
              "target_id": "archer:a",
              "disposition": "knocked_out",
              "gm_approved": true
            }
          ]
        }
      ]
    }
  },
  "seed_scheme": "towr:npc-ranged-trial:v1",
  "runtime": {
    "package_version": "0.1.0",
    "python_implementation": "CPython",
    "python_version": "3.14.5",
    "rng": "random.Random"
  },
  "summary": {
    "outcome_counts": {
      "objective_achieved": 0,
      "side_defeated": 3,
      "round_limit": 0,
      "unsupported_path": 0
    },
    "total_attack_count": 10,
    "total_visited_round_count": 5,
    "mean_attack_count": 3.3333333333333335,
    "mean_visited_round_count": 1.6666666666666667
  },
  "trials": [
    {
      "trial_index": 0,
      "seed_hex": "d291ffdc8bbf9cb53ef463decdc8712939186fabbf203212a1781c57bd291c6d",
      "outcome": "side_defeated",
      "executed_attack_count": 4,
      "visited_round_count": 2
    },
    {
      "trial_index": 1,
      "seed_hex": "2a3e7f25452d3a0cf8308f505302202a2e31b67e2164652581bac37d495c5ef3",
      "outcome": "side_defeated",
      "executed_attack_count": 2,
      "visited_round_count": 1
    },
    {
      "trial_index": 2,
      "seed_hex": "8d28e37a78362a29ad78c0504411c3ecf9215199f8de30d73716915741968264",
      "outcome": "side_defeated",
      "executed_attack_count": 4,
      "visited_round_count": 2
    }
  ]
}
